[
  {
    "id": "google/gemini-2.5-pro",
    "provider": "google",
    "tier": "pay_as_you_go",
    "cost_input_per_m": 1.25,
    "cost_output_per_m": 10.00,
    "context_window": 2000000,
    "supports_tools": true,
    "complexity_score": 5,
    "supports_vision": true,
    "supports_reasoning": true,
    "source_url": "https://ai.google.dev/pricing"
  },
  {
    "id": "google/gemini-2.5-pro-free",
    "provider": "google",
    "tier": "free_tier",
    "cost_input_per_m": 0.0,
    "cost_output_per_m": 0.0,
    "context_window": 2000000,
    "supports_tools": true,
    "complexity_score": 5,
    "supports_vision": true,
    "supports_reasoning": true,
    "source_url": "https://ai.google.dev/pricing"
  },
  {
    "id": "google/gemini-2.5-flash",
    "provider": "google",
    "tier": "pay_as_you_go",
    "cost_input_per_m": 0.30,
    "cost_output_per_m": 2.50,
    "context_window": 1000000,
    "supports_tools": true,
    "complexity_score": 3,
    "supports_vision": true,
    "supports_reasoning": true,
    "source_url": "https://ai.google.dev/pricing"
  },
  {
    "id": "google/gemini-2.0-flash",
    "provider": "google",
    "tier": "pay_as_you_go",
    "cost_input_per_m": 0.10,
    "cost_output_per_m": 0.40,
    "context_window": 1048576,
    "supports_tools": true,
    "complexity_score": 3,
    "supports_vision": true,
    "supports_reasoning": false,
    "source_url": "https://ai.google.dev/pricing"
  },
  {
    "id": "google/gemini-2.0-flash-lite",
    "provider": "google",
    "tier": "pay_as_you_go",
    "cost_input_per_m": 0.075,
    "cost_output_per_m": 0.30,
    "context_window": 1048576,
    "supports_tools": true,
    "complexity_score": 2,
    "supports_vision": true,
    "supports_reasoning": false,
    "source_url": "https://ai.google.dev/pricing"
  },
  {
    "id": "google/gemini-3.1-pro",
    "provider": "google",
    "tier": "pay_as_you_go",
    "cost_input_per_m": 2.00,
    "cost_output_per_m": 12.00,
    "context_window": 2000000,
    "supports_tools": true,
    "complexity_score": 5,
    "supports_vision": true,
    "supports_reasoning": true,
    "source_url": "https://ai.google.dev/pricing"
  },
  {
    "id": "google/gemini-3.5-flash",
    "provider": "google",
    "tier": "pay_as_you_go",
    "cost_input_per_m": 1.50,
    "cost_output_per_m": 9.00,
    "context_window": 1000000,
    "supports_tools": true,
    "complexity_score": 4,
    "supports_vision": true,
    "supports_reasoning": true,
    "source_url": "https://ai.google.dev/pricing"
  },
  {
    "id": "anthropic/claude-3.7-sonnet",
    "provider": "anthropic",
    "tier": "pay_as_you_go",
    "cost_input_per_m": 3.00,
    "cost_output_per_m": 15.00,
    "context_window": 2000000,
    "supports_tools": true,
    "complexity_score": 5,
    "supports_vision": true,
    "supports_reasoning": true,
    "source_url": "https://www.anthropic.com/pricing"
  },
  {
    "id": "anthropic/claude-3.5-sonnet",
    "provider": "anthropic",
    "tier": "pay_as_you_go",
    "cost_input_per_m": 3.00,
    "cost_output_per_m": 15.00,
    "context_window": 200000,
    "supports_tools": true,
    "complexity_score": 5,
    "supports_vision": true,
    "supports_reasoning": false,
    "source_url": "https://www.anthropic.com/pricing"
  },
  {
    "id": "anthropic/claude-3.5-haiku",
    "provider": "anthropic",
    "tier": "pay_as_you_go",
    "cost_input_per_m": 0.80,
    "cost_output_per_m": 4.00,
    "context_window": 200000,
    "supports_tools": true,
    "complexity_score": 2,
    "supports_vision": false,
    "supports_reasoning": false,
    "source_url": "https://www.anthropic.com/pricing"
  },
  {
    "id": "openai/gpt-4o",
    "provider": "openai",
    "tier": "pay_as_you_go",
    "cost_input_per_m": 2.50,
    "cost_output_per_m": 10.00,
    "context_window": 128000,
    "supports_tools": true,
    "complexity_score": 4,
    "supports_vision": true,
    "supports_reasoning": false,
    "source_url": "https://openai.com/api/pricing/"
  },
  {
    "id": "openai/gpt-4o-mini",
    "provider": "openai",
    "tier": "pay_as_you_go",
    "cost_input_per_m": 0.15,
    "cost_output_per_m": 0.60,
    "context_window": 128000,
    "supports_tools": true,
    "complexity_score": 2,
    "supports_vision": true,
    "supports_reasoning": false,
    "source_url": "https://openai.com/api/pricing/"
  },
  {
    "id": "openai/o1",
    "provider": "openai",
    "tier": "pay_as_you_go",
    "cost_input_per_m": 15.00,
    "cost_output_per_m": 60.00,
    "context_window": 200000,
    "supports_tools": true,
    "complexity_score": 5,
    "supports_vision": true,
    "supports_reasoning": true,
    "source_url": "https://openai.com/api/pricing/"
  },
  {
    "id": "openai/o3",
    "provider": "openai",
    "tier": "pay_as_you_go",
    "cost_input_per_m": 10.00,
    "cost_output_per_m": 30.00,
    "context_window": 200000,
    "supports_tools": true,
    "complexity_score": 5,
    "supports_vision": true,
    "supports_reasoning": true,
    "source_url": "https://openai.com/api/pricing/"
  },
  {
    "id": "openai/o3-mini",
    "provider": "openai",
    "tier": "pay_as_you_go",
    "cost_input_per_m": 1.10,
    "cost_output_per_m": 4.40,
    "context_window": 200000,
    "supports_tools": true,
    "complexity_score": 4,
    "supports_vision": false,
    "supports_reasoning": true,
    "source_url": "https://openai.com/api/pricing/"
  },
  {
    "id": "openai/o4-mini",
    "provider": "openai",
    "tier": "pay_as_you_go",
    "cost_input_per_m": 0.60,
    "cost_output_per_m": 2.40,
    "context_window": 128000,
    "supports_tools": true,
    "complexity_score": 4,
    "supports_vision": true,
    "supports_reasoning": true,
    "source_url": "https://openai.com/api/pricing/"
  },
  {
    "id": "mistral/mistral-large-3",
    "provider": "mistral",
    "tier": "pay_as_you_go",
    "cost_input_per_m": 0.50,
    "cost_output_per_m": 1.50,
    "context_window": 262144,
    "supports_tools": true,
    "complexity_score": 4,
    "supports_vision": false,
    "supports_reasoning": false,
    "source_url": "https://mistral.ai/technology/#pricing"
  },
  {
    "id": "mistral/codestral-2508",
    "provider": "mistral",
    "tier": "pay_as_you_go",
    "cost_input_per_m": 0.30,
    "cost_output_per_m": 0.90,
    "context_window": 256000,
    "supports_tools": true,
    "complexity_score": 3,
    "supports_vision": false,
    "supports_reasoning": false,
    "source_url": "https://mistral.ai/technology/#pricing"
  },
  {
    "id": "mistral/mistral-small-4",
    "provider": "mistral",
    "tier": "pay_as_you_go",
    "cost_input_per_m": 0.15,
    "cost_output_per_m": 0.60,
    "context_window": 128000,
    "supports_tools": true,
    "complexity_score": 3,
    "supports_vision": false,
    "supports_reasoning": false,
    "source_url": "https://mistral.ai/technology/#pricing"
  },
  {
    "id": "mistral/ministral-3b",
    "provider": "mistral",
    "tier": "pay_as_you_go",
    "cost_input_per_m": 0.10,
    "cost_output_per_m": 0.10,
    "context_window": 128000,
    "supports_tools": true,
    "complexity_score": 1,
    "supports_vision": false,
    "supports_reasoning": false,
    "source_url": "https://mistral.ai/technology/#pricing"
  },
  {
    "id": "mistral/ministral-8b",
    "provider": "mistral",
    "tier": "pay_as_you_go",
    "cost_input_per_m": 0.15,
    "cost_output_per_m": 0.15,
    "context_window": 128000,
    "supports_tools": true,
    "complexity_score": 2,
    "supports_vision": false,
    "supports_reasoning": false,
    "source_url": "https://mistral.ai/technology/#pricing"
  },
  {
    "id": "mistral/pixtral-large",
    "provider": "mistral",
    "tier": "pay_as_you_go",
    "cost_input_per_m": 2.00,
    "cost_output_per_m": 6.00,
    "context_window": 128000,
    "supports_tools": true,
    "complexity_score": 4,
    "supports_vision": true,
    "supports_reasoning": false,
    "source_url": "https://mistral.ai/technology/#pricing"
  },
  {
    "id": "groq/llama-3.3-70b-versatile",
    "provider": "groq",
    "tier": "pay_as_you_go",
    "cost_input_per_m": 0.59,
    "cost_output_per_m": 0.79,
    "context_window": 128000,
    "supports_tools": true,
    "complexity_score": 4,
    "supports_vision": false,
    "supports_reasoning": false,
    "source_url": "https://groq.com/pricing/"
  },
  {
    "id": "groq/llama-3.1-8b-instant",
    "provider": "groq",
    "tier": "pay_as_you_go",
    "cost_input_per_m": 0.05,
    "cost_output_per_m": 0.08,
    "context_window": 128000,
    "supports_tools": true,
    "complexity_score": 2,
    "supports_vision": false,
    "supports_reasoning": false,
    "source_url": "https://groq.com/pricing/"
  },
  {
    "id": "groq/qwen-2.5-coder-32b",
    "provider": "groq",
    "tier": "pay_as_you_go",
    "cost_input_per_m": 0.60,
    "cost_output_per_m": 0.80,
    "context_window": 128000,
    "supports_tools": true,
    "complexity_score": 3,
    "supports_vision": false,
    "supports_reasoning": false,
    "source_url": "https://groq.com/pricing/"
  },
  {
    "id": "cerebras/llama-3.1-8b",
    "provider": "cerebras",
    "tier": "pay_as_you_go",
    "cost_input_per_m": 0.05,
    "cost_output_per_m": 0.08,
    "context_window": 128000,
    "supports_tools": true,
    "complexity_score": 2,
    "supports_vision": false,
    "supports_reasoning": false,
    "source_url": "https://cerebras.ai/pricing"
  },
  {
    "id": "cerebras/llama-3.3-70b",
    "provider": "cerebras",
    "tier": "pay_as_you_go",
    "cost_input_per_m": 0.59,
    "cost_output_per_m": 0.79,
    "context_window": 128000,
    "supports_tools": true,
    "complexity_score": 4,
    "supports_vision": false,
    "supports_reasoning": false,
    "source_url": "https://cerebras.ai/pricing"
  },
  {
    "id": "openrouter/qwen-2.5-coder-32b:free",
    "provider": "openrouter",
    "tier": "free_tier",
    "cost_input_per_m": 0.0,
    "cost_output_per_m": 0.0,
    "context_window": 32768,
    "supports_tools": true,
    "complexity_score": 3,